<?xml version="1.0" encoding="UTF-8"?>
<CBEC xsi:schemaLocation="urn:gacc:datamodel:GZ:CBEC202:1 CBEC202_DeclarationResponse.xsd" xmlns="urn:gacc:datamodel:GZ:CBEC202:1" xmlns:xsi="http://www.w3.org/2001/XMLSchema-instance">
	<Head>
		<MessageID>CBEC202_1p0_5100_20151112161304_0000018</MessageID>
		<FunctionCode>2</FunctionCode>
		<MessageType>CBEC202</MessageType>
		<SenderID>5100</SenderID>
		<ReceiverID>PTE51011400000000001</ReceiverID>
		<SendTime>2015-11-12T16:13:04.957</SendTime>
		<Version>1.0</Version>
	</Head>
	<Response>
		<CreationTime>2015-11-12T16:13:04.957</CreationTime>
		<Declaration>
			<Declarant>
				<Company>
					<RegistrationNumber>PTE51011400000000001</RegistrationNumber>
				</Company>
			</Declarant>
			<DocumentID>CBEC102_1p0_PTE51011400000000001_20151112153149042_7104183.xml</DocumentID>
			<DocumentTypeCode>CBEC100</DocumentTypeCode>
		</Declaration>
		<Main>
			<Code>16</Code>
			<Text>cvc-type.3.1.3: 元素 'RegistrationNumber' 的值 '' 无效。</Text>
		</Main>
	</Response>
</CBEC>